{
  "format": "org.frifra.vibedock.theme",
  "schemaVersion": 1,
  "id": "departure_board",
  "version": "1.1.0",
  "name": "Departure Board",
  "author": "VibeDock contributors; Twemoji contributors (icon)",
  "license": "Apache-2.0 AND CC-BY-4.0",
  "renderer": {
    "id": "vibedock-2d",
    "version": 1
  },
  "definition": "style.json",
  "defaultIcon": "theme",
  "icons": [
    {
      "id": "legacy",
      "label": "Existing theme illustration",
      "file": "assets/default.svg"
    },
    {
      "id": "theme",
      "label": "Dot-matrix aircraft",
      "file": "assets/theme.svg"
    }
  ],
  "files": {
    "assets/default.svg": "d32bd9f51b2a54f620f9693e833935c5e2cb2304cbf89aab75fd10f054711ce5",
    "license.txt": "8c301a734b12bde1081d42ca166e4b8649f968554aa7b3cda7fa48e47f06e03d",
    "style.json": "de7709a35083730888e5f63c230fb699ea82e39841351daa3d437ecf6b350974",
    "assets/theme.svg": "351102795cbfdb1e5940dd9078926708ed68366dfc45c2d45aaa8f31445567b4"
  }
}
