{
  "format": "org.frifra.vibedock.theme",
  "schemaVersion": 1,
  "id": "starship",
  "version": "1.2.0",
  "name": "Starship console",
  "author": "VibeDock contributors; Twemoji contributors (icon)",
  "license": "Apache-2.0 AND CC-BY-4.0",
  "renderer": {
    "id": "vibedock-2d",
    "version": 1
  },
  "definition": "style.json",
  "defaultIcon": "theme",
  "icons": [
    {
      "id": "legacy",
      "label": "Existing theme illustration",
      "file": "assets/default.svg"
    },
    {
      "id": "theme",
      "label": "Vulcan salute",
      "file": "assets/theme.svg"
    }
  ],
  "files": {
    "assets/default.svg": "83d1f70bde27d2a1321c1b755bb68508cb29360011d7935fd9e19bfef2fd86c0",
    "license.txt": "92892a5059f0ff30e8f7bb6a7c1c32d644ea7d9656e2a44d4ef203d619cd59a4",
    "style.json": "69e42b2b5ffb334b2fb127952be742bf7cda31786302d29c101fd31c66ea11e3",
    "assets/theme.svg": "eac01f56983351c822b1061240ab213a46a8a6bc329bddfcf99be8a2f08ec40a"
  }
}
