{
  "format": "org.frifra.vibedock.theme",
  "schemaVersion": 1,
  "id": "bauhaus",
  "version": "1.1.0",
  "name": "Bauhaus",
  "author": "VibeDock contributors; Twemoji contributors (icon)",
  "license": "Apache-2.0 AND CC-BY-4.0",
  "renderer": {
    "id": "vibedock-2d",
    "version": 1
  },
  "definition": "style.json",
  "defaultIcon": "theme",
  "icons": [
    {
      "id": "legacy",
      "label": "Existing theme illustration",
      "file": "assets/default.svg"
    },
    {
      "id": "theme",
      "label": "Geometric face",
      "file": "assets/theme.svg"
    }
  ],
  "files": {
    "assets/default.svg": "d32bd9f51b2a54f620f9693e833935c5e2cb2304cbf89aab75fd10f054711ce5",
    "license.txt": "8c301a734b12bde1081d42ca166e4b8649f968554aa7b3cda7fa48e47f06e03d",
    "style.json": "f45e941305fa140479e72d4e08af2f3415b4bbc2615c169671a82e6f0b10d7ec",
    "assets/theme.svg": "869603ee6504f85fb7dccadf0797b80b86d8be943d5a2d03c95bb1055b13fff5"
  }
}
