{
  "format": "org.frifra.vibedock.theme",
  "schemaVersion": 1,
  "id": "lavender",
  "version": "1.0.0",
  "name": "Lavender",
  "author": "VibeDock contributors; Twemoji contributors (icon)",
  "license": "Apache-2.0 AND CC-BY-4.0",
  "renderer": {
    "id": "vibedock-2d",
    "version": 1
  },
  "definition": "style.json",
  "defaultIcon": "legacy",
  "icons": [
    {
      "id": "legacy",
      "label": "Existing theme illustration",
      "file": "assets/default.svg"
    }
  ],
  "files": {
    "assets/default.svg": "6063b1ca7021881784eb5a8110997357026fb7376785e639850335a9c422a639",
    "license.txt": "51b1cd34a658c625e2ead275fa2ed5bcf6b4cd47544637002011b016b562ae24",
    "style.json": "c298c0c0cfad801b23c23aca8cf76e0cf6b3596c3a400b0a856ffa0baa0620c0"
  }
}
