{
  "format": "org.frifra.vibedock.theme",
  "schemaVersion": 1,
  "id": "debugger",
  "version": "1.1.0",
  "name": "Debugger",
  "author": "VibeDock contributors; Twemoji contributors (icon)",
  "license": "Apache-2.0 AND CC-BY-4.0",
  "renderer": {
    "id": "vibedock-2d",
    "version": 1
  },
  "definition": "style.json",
  "defaultIcon": "theme",
  "icons": [
    {
      "id": "legacy",
      "label": "Existing theme illustration",
      "file": "assets/default.svg"
    },
    {
      "id": "theme",
      "label": "IDE debugger bug",
      "file": "assets/theme.svg"
    }
  ],
  "files": {
    "assets/default.svg": "d32bd9f51b2a54f620f9693e833935c5e2cb2304cbf89aab75fd10f054711ce5",
    "license.txt": "8c301a734b12bde1081d42ca166e4b8649f968554aa7b3cda7fa48e47f06e03d",
    "style.json": "9d9558238b9a52643b44611fc7e9e2adde02a63d709a5797e8c227bf599bc84d",
    "assets/theme.svg": "98b1ba329d04bd454d0d56b05aee17e0c1f8c7a0a0dfb17c4226d2139336bab8"
  }
}
