{
  "format": "org.frifra.vibedock.theme",
  "schemaVersion": 1,
  "id": "github_dark",
  "version": "1.1.0",
  "name": "GitHub Dark",
  "author": "VibeDock contributors; Twemoji contributors (icon)",
  "license": "Apache-2.0 AND CC-BY-4.0",
  "renderer": {
    "id": "vibedock-2d",
    "version": 1
  },
  "definition": "style.json",
  "defaultIcon": "theme",
  "icons": [
    {
      "id": "legacy",
      "label": "Existing theme illustration",
      "file": "assets/default.svg"
    },
    {
      "id": "theme",
      "label": "Cat",
      "file": "assets/theme.svg"
    }
  ],
  "files": {
    "assets/default.svg": "d32bd9f51b2a54f620f9693e833935c5e2cb2304cbf89aab75fd10f054711ce5",
    "license.txt": "8c301a734b12bde1081d42ca166e4b8649f968554aa7b3cda7fa48e47f06e03d",
    "style.json": "30bf6a5d05683d702571ef83e9a5786fbfb0fcfd7e04676c3ecacf3ea5841ef7",
    "assets/theme.svg": "32e8e8b0a2d55234c6b5e71e4cea195bb48ac440a5b4ac982da703af47488d9c"
  }
}
