{
  "format": "org.frifra.vibedock.theme",
  "schemaVersion": 1,
  "id": "terminal",
  "version": "1.1.0",
  "name": "Terminal",
  "author": "VibeDock contributors; Twemoji contributors (icon)",
  "license": "Apache-2.0 AND CC-BY-4.0",
  "renderer": {
    "id": "vibedock-2d",
    "version": 1
  },
  "definition": "style.json",
  "defaultIcon": "theme",
  "icons": [
    {
      "id": "legacy",
      "label": "Existing theme illustration",
      "file": "assets/default.svg"
    },
    {
      "id": "theme",
      "label": "Friendly prompt",
      "file": "assets/theme.svg"
    }
  ],
  "files": {
    "assets/default.svg": "d32bd9f51b2a54f620f9693e833935c5e2cb2304cbf89aab75fd10f054711ce5",
    "license.txt": "8c301a734b12bde1081d42ca166e4b8649f968554aa7b3cda7fa48e47f06e03d",
    "style.json": "ff0a280b00f63faadb6c6bc5b4b28b0dbe5769d00628b99d62bb8113dd3964a9",
    "assets/theme.svg": "5cef5e27fea1d4300da88f9c2a1a74b9b355d34268f4dbbad28b0d7d68a067ad"
  }
}
